{
  "$schema": "https://json-schema.org/draft/2020-12/schema",
  "$id": "https://vpp.local/schemas/events/schedule-approved.v1.schema.json",
  "title": "Schedule approved event",
  "type": "object",
  "additionalProperties": true,
  "required": [
    "schema_version", "event_id", "event_type", "tenant_id", "schedule_id", "schedule_version",
    "portfolio_id", "interval_start", "interval_end", "forecast_version", "tariff_version",
    "device_config_snapshot_id", "algorithm_version", "approved_by", "approved_at", "content_sha256"
  ],
  "properties": {
    "schema_version": { "const": 1 },
    "event_id": { "type": "string", "format": "uuid" },
    "event_type": { "const": "ScheduleApproved" },
    "tenant_id": { "type": "string", "format": "uuid" },
    "schedule_id": { "type": "string", "format": "uuid" },
    "schedule_version": { "type": "integer", "minimum": 1 },
    "portfolio_id": { "type": "string", "format": "uuid" },
    "interval_start": { "type": "string", "format": "date-time" },
    "interval_end": { "type": "string", "format": "date-time" },
    "forecast_version": { "type": "string", "format": "uuid" },
    "tariff_version": { "type": "string", "format": "uuid" },
    "device_config_snapshot_id": { "type": "string", "format": "uuid" },
    "algorithm_version": { "type": "string", "minLength": 1, "maxLength": 128 },
    "approved_by": { "type": "string", "format": "uuid" },
    "approved_at": { "type": "string", "format": "date-time" },
    "content_sha256": { "type": "string", "pattern": "^[a-f0-9]{64}$" }
  }
}
